{
  "schema_version": "coding-harness.delivery/v1",
  "id": "delivery-flow-pilot",
  "outcome": "An owner can inspect which tests prove each delivery criterion, identify omitted tiers, and see that human acceptance is still pending.",
  "design": "docs/decisions/0044-delivery-flow-starts-with-an-acceptance-map.md",
  "constraints": [
    "Use the existing pinned kernel, pack release hashes, and command-review receipts.",
    "Do not execute product test commands during plan or receipt checking.",
    "Never infer human approval from test success or authenticate a typed reviewer name.",
    "Keep game-design product code and its existing sources of truth unchanged."
  ],
  "scope": ["packs/delivery-flow", "test/delivery-flow.test.mjs", "scripts/check-delivery.mjs", "dist/packs/delivery-flow"],
  "acceptance": [
    {"id": "AC-01", "description": "A plan with missing criteria, dangling references, escaping paths, or unaddressed test tiers fails.", "checks": ["delivery"]},
    {"id": "AC-02", "description": "The pinned pack composes into a real fixture consumer, runs repeatedly, fails on injected damage, and passes after revert.", "checks": ["delivery"]},
    {"id": "AC-03", "description": "A planned report cannot claim verified evidence, human acceptance, or merge authorization.", "checks": ["delivery"]}
  ],
  "checks": [{
    "id": "delivery",
    "tier": "integration",
    "command": "node --test test/delivery-flow.test.mjs",
    "test_files": ["test/delivery-flow.test.mjs"],
    "expected_failure": "0 !== 1"
  }],
  "tier_waivers": [
    {"tier": "unit", "reason": "This pilot checks the checker and real CLI/pack composition together; receipt semantics have additional module-seam coverage in test/delivery-evidence.test.mjs."},
    {"tier": "e2e", "reason": "The fixture exercises a local hashed pack and source CLI, not a remotely published release or a graphical application. Shipping-product and game acceptance remain outside this pilot."}
  ]
}
